{"advisory_only":true,"allowed_fields":["canon_status","ci_status","continuity_lane_count","governance_status","last_sync_packet_hash","merge_status","milestone","repo","source_artifact_hashes"],"artifact_type":"NotionWritebackDryRunPlan.v1","authority_locks":{"canon_promotion":false,"execution_authority":false,"forecast_authority":false,"notion_mutation_authority":false,"runtime_mutation":false,"scheduler_mutation":false,"token_minting":false},"dry_run_only":true,"evidence_only":true,"forbidden_actions":["unverified_notion_write","database_schema_mutation","page_deletion","content_replacement_without_old_str","runtime_mutation","canon_promotion","scheduler_mutation","token_minting","forecast_authority_grant"],"github_writeback":false,"missing_evidence":[],"notion_writeback":false,"packet_hash":"47b287d25bbf85666545d8c4652b04c0a29d6b159d7297cc6947cf1e536c6f9f","plan_id":"NOTION_WRITEBACK_DRY_RUN_PLAN_001","plan_status":"NOT_COMPUTABLE","planned_operations":[],"projection_only":true,"recommended_next_lane":"NOTION_WRITEBACK_AUTHORIZATION_GATE_REQUIRED","source_artifact_hashes":{"docs/status/badges.json":"425cfc664d9d1e563419834a5d700139835d0efb74e48adf9a46debe698aef64","docs/status/continuity-spine.json":"3878482db00fbf474f204490aa1a0d96a19524f9f42a750d56f46acf4ebb8145","out/continuity_namespace_alias_plan/latest.json":"2d4d13dbbd5b2c4434c96c71b5854290fb3e8fcacdf1a990b6f9af1a3b47045e"},"target_label":"NOT_COMPUTABLE","target_page_id":"NOT_COMPUTABLE","target_state":"TARGET_NOT_CONFIGURED","valid_for_execution":false,"writeback_authorized":false,"writeback_performed":false}
